{
  "schemaVersion": "benchmark-run-v1",
  "benchmarkVersion": "openfront-bench-v0.1",
  "classification": "external-self-run",
  "complete": false,
  "manifestHash": "158ab7aa3fe04452df162b320ddc6429fc789548867044893c7916abf1b856a9",
  "runId": "2e7eb0ae-43eb-4e36-9a7e-7140a4a59a8e",
  "runnerSeed": "luna-none-public-v0.1-r2",
  "bootstrapSeed": "luna-none-public-v0.1-r2-bootstrap",
  "bootstrapReplicates": 10000,
  "declaredTrials": {
    "matchPerTask": 3,
    "capabilityPerFixture": 10
  },
  "completedTrials": {
    "match": 0,
    "capability": 2
  },
  "taskOrder": [
    "cap-saturated-capacity-expansion-scored-world-001",
    "cap-incoming-attack-response-scored-great-lakes-001",
    "cap-naval-target-recognition-scored-strait-of-gibraltar-001",
    "cap-naval-target-recognition-scored-strait-of-gibraltar-001",
    "cap-post-expansion-recovery-scored-europe-classic-001",
    "match-02",
    "cap-split-front-defense-scored-four-islands-001",
    "cap-losing-attack-retreat-scored-world-001",
    "cap-incoming-attack-response-scored-great-lakes-001",
    "cap-saturated-capacity-expansion-scored-world-001",
    "cap-naval-target-recognition-scored-strait-of-gibraltar-001",
    "cap-construction-failure-recovery-scored-europe-classic-001",
    "cap-naval-target-recognition-scored-strait-of-gibraltar-001",
    "cap-saturated-capacity-expansion-scored-world-001",
    "match-03",
    "cap-post-expansion-recovery-scored-europe-classic-001",
    "cap-saturated-capacity-expansion-scored-world-001",
    "match-03",
    "cap-neutral-expansion-scored-great-lakes-001",
    "cap-post-expansion-recovery-scored-europe-classic-001",
    "cap-frontier-restraint-scored-strait-of-gibraltar-001",
    "cap-neutral-expansion-scored-great-lakes-001",
    "cap-losing-attack-retreat-scored-world-001",
    "match-01",
    "match-08",
    "match-06",
    "cap-neutral-expansion-scored-great-lakes-001",
    "cap-weaker-target-selection-scored-europe-classic-001",
    "cap-frontier-restraint-scored-strait-of-gibraltar-001",
    "match-11",
    "cap-post-expansion-recovery-scored-europe-classic-001",
    "cap-losing-attack-retreat-scored-world-001",
    "cap-construction-failure-recovery-scored-europe-classic-001",
    "cap-neutral-expansion-scored-great-lakes-001",
    "cap-neutral-expansion-scored-great-lakes-001",
    "match-04",
    "cap-incoming-attack-response-scored-great-lakes-001",
    "match-11",
    "match-04",
    "cap-weaker-target-selection-scored-europe-classic-001",
    "cap-weaker-target-selection-scored-europe-classic-001",
    "cap-split-front-defense-scored-four-islands-001",
    "match-02",
    "cap-construction-failure-recovery-scored-europe-classic-001",
    "match-04",
    "match-12",
    "cap-split-front-defense-scored-four-islands-001",
    "cap-split-front-defense-scored-four-islands-001",
    "match-06",
    "cap-losing-attack-retreat-scored-world-001",
    "cap-losing-attack-retreat-scored-world-001",
    "cap-saturated-capacity-expansion-scored-world-001",
    "cap-losing-attack-retreat-scored-world-001",
    "match-09",
    "cap-weaker-target-selection-scored-europe-classic-001",
    "cap-frontier-restraint-scored-strait-of-gibraltar-001",
    "cap-saturated-capacity-expansion-scored-world-001",
    "cap-post-expansion-recovery-scored-europe-classic-001",
    "cap-weaker-target-selection-scored-europe-classic-001",
    "cap-weaker-target-selection-scored-europe-classic-001",
    "cap-losing-attack-retreat-scored-world-001",
    "cap-post-expansion-recovery-scored-europe-classic-001",
    "cap-post-expansion-recovery-scored-europe-classic-001",
    "cap-construction-failure-recovery-scored-europe-classic-001",
    "match-05",
    "match-08",
    "cap-losing-attack-retreat-scored-world-001",
    "cap-post-expansion-recovery-scored-europe-classic-001",
    "cap-incoming-attack-response-scored-great-lakes-001",
    "match-02",
    "cap-incoming-attack-response-scored-great-lakes-001",
    "cap-naval-target-recognition-scored-strait-of-gibraltar-001",
    "cap-split-front-defense-scored-four-islands-001",
    "cap-neutral-expansion-scored-great-lakes-001",
    "match-12",
    "cap-construction-failure-recovery-scored-europe-classic-001",
    "cap-frontier-restraint-scored-strait-of-gibraltar-001",
    "cap-frontier-restraint-scored-strait-of-gibraltar-001",
    "match-10",
    "cap-neutral-expansion-scored-great-lakes-001",
    "cap-incoming-attack-response-scored-great-lakes-001",
    "cap-neutral-expansion-scored-great-lakes-001",
    "match-01",
    "match-01",
    "match-06",
    "cap-naval-target-recognition-scored-strait-of-gibraltar-001",
    "cap-construction-failure-recovery-scored-europe-classic-001",
    "match-05",
    "cap-frontier-restraint-scored-strait-of-gibraltar-001",
    "cap-naval-target-recognition-scored-strait-of-gibraltar-001",
    "cap-naval-target-recognition-scored-strait-of-gibraltar-001",
    "match-12",
    "cap-weaker-target-selection-scored-europe-classic-001",
    "match-10",
    "cap-neutral-expansion-scored-great-lakes-001",
    "cap-frontier-restraint-scored-strait-of-gibraltar-001",
    "cap-weaker-target-selection-scored-europe-classic-001",
    "cap-saturated-capacity-expansion-scored-world-001",
    "cap-losing-attack-retreat-scored-world-001",
    "cap-weaker-target-selection-scored-europe-classic-001",
    "cap-post-expansion-recovery-scored-europe-classic-001",
    "match-08",
    "match-07",
    "cap-split-front-defense-scored-four-islands-001",
    "cap-construction-failure-recovery-scored-europe-classic-001",
    "cap-construction-failure-recovery-scored-europe-classic-001",
    "cap-construction-failure-recovery-scored-europe-classic-001",
    "cap-saturated-capacity-expansion-scored-world-001",
    "cap-frontier-restraint-scored-strait-of-gibraltar-001",
    "cap-split-front-defense-scored-four-islands-001",
    "cap-saturated-capacity-expansion-scored-world-001",
    "cap-losing-attack-retreat-scored-world-001",
    "cap-incoming-attack-response-scored-great-lakes-001",
    "cap-split-front-defense-scored-four-islands-001",
    "cap-naval-target-recognition-scored-strait-of-gibraltar-001",
    "match-11",
    "cap-frontier-restraint-scored-strait-of-gibraltar-001",
    "cap-frontier-restraint-scored-strait-of-gibraltar-001",
    "match-09",
    "cap-naval-target-recognition-scored-strait-of-gibraltar-001",
    "match-05",
    "match-09",
    "cap-construction-failure-recovery-scored-europe-classic-001",
    "cap-incoming-attack-response-scored-great-lakes-001",
    "cap-incoming-attack-response-scored-great-lakes-001",
    "cap-saturated-capacity-expansion-scored-world-001",
    "match-07",
    "cap-neutral-expansion-scored-great-lakes-001",
    "cap-incoming-attack-response-scored-great-lakes-001",
    "cap-post-expansion-recovery-scored-europe-classic-001",
    "cap-split-front-defense-scored-four-islands-001",
    "match-03",
    "cap-split-front-defense-scored-four-islands-001",
    "match-07",
    "match-10",
    "cap-weaker-target-selection-scored-europe-classic-001"
  ],
  "trialReferences": [
    "trials/000.json",
    "trials/001.json"
  ],
  "invalidTrials": [],
  "summaries": {
    "matchScore": null,
    "matchBootstrap95": null,
    "capabilityScore": 50,
    "capabilityBootstrap95": {
      "lower": 50,
      "upper": 50
    },
    "winRate": null,
    "meanPlacement": null,
    "survivalRate": null,
    "matchTasks": [],
    "capabilities": {
      "saturated-capacity-expansion": {
        "successes": 1,
        "validTrials": 1,
        "passAt1": 1,
        "wilson95": {
          "lower": 0.20654931437723742,
          "upper": 1
        },
        "estimatedPassPower3": 1,
        "meanComponentCoverage": 1
      },
      "incoming-attack-response": {
        "successes": 0,
        "validTrials": 1,
        "passAt1": 0,
        "wilson95": {
          "lower": 0,
          "upper": 0.7934506856227626
        },
        "estimatedPassPower3": 0,
        "meanComponentCoverage": 0.5
      }
    },
    "firstAttemptValidityRate": 1,
    "fallbackRate": 0,
    "medianLatencyMs": 2490.3926874999997,
    "p95LatencyMs": 3454.9940687499993,
    "totalCostUsd": 0.00098075,
    "meanCostUsd": 0.000490375
  },
  "exactInvocation": "/Users/fahimahmed/.nvm/versions/node/v24.9.0/bin/node /Users/fahimahmed/projects/openfront-harness/scripts/RunBenchmark.ts --profile official --output=data/benchmarks/luna-official-v0.1-r2 --runner-seed=luna-none-public-v0.1-r2 --bootstrap-seed=luna-none-public-v0.1-r2-bootstrap"
}
